,Time_submitted,Review,Rating,Total_thumbsup,Reply
47587,2022-03-07 01:50:28,No matter what phone or how many times I update the app is buggy as hell. They should start paying me instead with the amount of bugs and glitches the app itself has. Only spotify of all the apps I have is the biggest annoyance. So with the latest hpdate now I dont have the ability to scroll down my list of 4000 songs like I used to before the update now I have to flick for like a minute or two to find my songs from back then. Seriously spotify quit removing features for no reason.,1,7,
27414,2022-04-29 23:59:54,So disappointed With this app. It no longer shows up coming songs and what's playing. I can't even stop a song as it plays. Spotifys solution is to uninstall the app and do a super clean of all data. And hope for the best.😠 Can't you just fix it? It wasn't broken before.,1,3,
41118,2022-03-31 00:41:31,"Why. Just why. I get 30 minutes of ad free, and then 5 minutes later, I get ads. Why?",1,2,
60441,2022-01-15 16:20:19,"Listening to podcasts on here is driving me nuts. I only downloaded spotify to listen to JRE. If I'm listening to a podcast and out my screen to sleep, the podcast eventually will freeze and no longer play. The podcast player often gets stuck on past episodes title/artwork but is playing a different pidcast and the timestamp freezes so i don't know where I am in the episode.",2,6,
12732,2022-06-10 19:56:03,Upgraded to premium for the purpose of listening to podcasts in a group with my wife while at work and you have to send the invite for her to join the group like 10 times before it finally works. Pauses and skips a lot. Sometimes it will go back a few seconds or more and repeat things. Not impressed at all.,1,0,
40999,2022-03-31 13:13:39,"Disappointed how bad this has got now, honestly dont know why I'm still paying for premium, every track drops out for like 3 seconds in different parts of the song, impossible to enjoy any music I play, the app itself exits on it's own whilst I'm listening to it on my phone, it's a joke, it's got nothing to do with signal or data either as my tracks are downloaded and it does it over wifi too.",1,6,
56504,2022-01-31 13:43:18,"Too many advertisement, all subscription plan very costly, so much Content unavailable.",1,1,
57946,2022-01-27 13:55:59,"There's no Niel Young on here, that's a huge miss for a music streaming app lol.",1,7,
35554,2022-04-14 17:11:46,"App is so buggy now, it's time to cancel my premium family plan, what good is it when it randomly stops, plays wrong songs, takes forever to load, and half the time the controls aren't displayed",1,1,
13217,2022-06-09 13:42:10,Trying to use it for podcasts and it keeps having issues with stopping and not showing the play/track bar,2,0,
45896,2022-03-09 18:14:59,My daughter has been trying to cancel her subscription but no one is answering her back and the email she originally used is no longer active. There is no way to contact a person. Tried calling the number that is connected to the payment that is taken out of my account monthly is absolutely useless.,1,1,
56487,2022-01-31 14:44:14,Deleting from all devices. Public health is neither an issue of free speech or politics. Least of all profit.,1,2,
21359,2022-05-17 00:20:31,Bruh hate the update I should be able to lesson to the songs I want not have random ones in my playlist play I want to be able to lesson to them all not Spotify randomly chosing one I hate this update so much pls Spotify get rid of this up date ! It's horrible worst than sound cloud rn,1,0,
38847,2022-04-10 15:55:02,Garbage app. Worst player right now. Keeps crashing. On a s21 ultra cmon.,1,0,
56571,2022-01-31 08:46:01,"IMO This company is, by its actions, vile and their APK is poorly coded anyways. Just not worth the bother with poor feature set, convoluted functionality along with spreaders in their ranks. Used to be a decent APK but not anymore. Possibly fascist supporters. Ask any musicians: this platform is horrible towards music creators. Uninstalled. There are better alternative APK's. JMHO.",1,2,
24089,2022-05-09 04:46:50,"preview songs has been deprecated, makes it quite difficult to make new playlists and explore new songs.",1,0,
55121,2022-02-05 02:53:22,"the recent update was a trash! lots of app crashes and bugs. I've been planning on switching to apple music because of spotify's stupid user interface, loads of bugs and app crashes",1,2,
25825,2022-05-04 12:26:26,Terrible as hell :( I can't even listen to only my playlist anymore. Spotify even adds other songs i don't like and doesn't let me skip or change it to one of my playlist. I can't even listen to the song i search. Theres no on and off shuffle for none premium. This is a really unfair update. I had to delete it because of that. >:( Clearly a lot of people also has this problem and are forced to delete this app now. This app was really nice and had potential but the update just ruins it.,1,0,
58859,2022-01-24 07:31:59,"After OS update, 1. playback stops randomly. 2. Does not seem to even show progress in UI several podcast episodes later. 3. Premium account refuses to play downloaded albums. (Playlist worked)",1,1,
6438,2022-06-25 08:08:14,Spotify is broken I can't play the song u wanted,1,0,
35035,2022-04-15 06:46:55,"The app keeps doing weird things like the play button and skip buttons disappear and the app sometimes ask me to log in, but I'm already logged in. Since the last update things got really bad in this app making the user experience difficult!",1,0,
21088,2022-05-17 19:46:53,"This app used to be great I used to recommend it to everyone. The reason I'm giving it 2 stars is because I can't rewind a song anymore and if you search for on thing it gives you another. I don't know if you were trying to update the app ,but you made it worse",2,0,
1166,2022-07-07 02:47:32,Way too many ads,1,0,
11696,2022-06-13 11:09:37,"Why the hell there is a hidden option ,in search it is not showing the song if it is hidden",1,0,
35302,2022-04-14 22:35:15,Buggy and unusable. Especially after the last update.,1,2,
46982,2022-03-08 18:34:13,I got logged out mid song and can't log back in through the Facebook tab. I am a premium user. They take money and log me out,1,2,
45499,2022-03-11 16:15:27,Sync problems. Clickin frw many times gets stuck in a loop. Casting to google tv showed no video some times.,1,1,
37443,2022-04-12 19:54:47,New update has broken something. Have to force close app to see music playing and skip songs. massive issue,1,0,
23734,2022-05-10 05:12:12,To much advertisement,1,0,
5166,2022-06-28 07:35:30,"How is there not an option to remove certain tabs like ""shows to try""or ""stay up to date""? The whole point of spotify is finding music that you like. I don't want to be spammed with the newest Trap or Pop or whatever. It is seriously off-putting.",1,0,
21029,2022-05-18 00:19:00,"BRING BACK THE SHUFFLE BUTTON. I read something about Adele saying that tracks are set up in a certain order to tell a story idk of it's true or not. While that may be the case my personal mix now no longer has the shuffle button and believe me when I say there is absolutely no trace of a story in there. If people want to hear this story they'll just play it in the right order, so bring back the shuffle button",2,0,
19746,2022-05-21 19:18:27,"The app is decent for listening to music, but I wish on the free music, you could have six skips and six rewinds. Also, when you hide songs once, you cannot unhide them, which is very frustrating.",2,1,
46628,2022-03-08 18:51:04,"i am really upset, ive been using spotify for a while now and i loved it until the app glitched out and when i tried sighing in again it said my email and password was incorrect and i knew i had the correct email and password bc i always write my emails and passwords down in my book. It made me upset please fix this glitch-",2,0,
34669,2022-04-15 17:50:46,"App crashes several times during a single podcast, something has gone badly wrong since update",2,1,
55761,2022-02-02 23:12:04,Used to use the app every day but i can't justify it now. Buying my own music and listening to what i dont have access to buy on YouTube now. Full of lies and controversy for an app that was supposed to be for listening to music.,1,0,
4698,2022-06-29 07:34:50,"Latest update I cannot pause, fast forward a song or close the app. Review just went from 5 stars to 1 star.",1,0,
51240,2022-02-19 04:40:38,Disappointed!!!!I thought Spotify is where I can choose my own music from my favorite artist and vibe. Well is not like that anymore. Yu choose your artist they pick songs for you and you dont skip if you don't like the one they chose for you. All this just to get us into the premium. We get the ads but how bout choosing my own music like how a Streaming app should be like. Spotify your letting YouTube get ahead with millions of subscribers. And yu just lost this customer. -$30,1,97,
13597,2022-06-08 11:43:43,It won't download. I've tried for 3 days. Not downloading. 👎,1,0,
37564,2022-04-12 17:36:48,"Latest update is terrible, app randomly stops. Play bar at the bottom disappears sometimes, can't control music without constant forced restarts.",1,1,
44729,2022-03-15 06:31:02,"I really loved this app, I'd been using it for over 3 years. However not too long ago, the app stopped working for me and it wouldn't even load my library properly and I ended up with a lot of missing songss and playlists. It also logged me out a few times, was incredibly slow and sometimes wouldn't even play anything at all. I ended up having to cancel my premium subscription because of this. However if there was one thing I always loved about Spotify, it wpould be its recommendations.",1,880,
47031,2022-03-08 18:31:14,"I got logged out of my Spotify account, i don't know how. I'm trying to log back in but it's not working. Please fix this asap.",1,1,
3876,2022-07-01 01:19:06,"I don't know about the paid version; ask someone else about that. As for the free version, way too many ads to even think about enjoying music, not to mention all the politically correct podcasts and musicians. Uninstall...",1,1,
18218,2022-05-26 13:53:04,"This app is not good at all... Comaparing it with apps like gaana and wynk it is far better. But, it keeps saying no internet connection since the very first day. It is very frustrating. After all,the music quality is good but what use is it if the songs are not playing. The amazon music app is a better choice for anyone who is facing this kind of problem. Pathetic app internet!!",1,0,
21853,2022-05-15 17:19:48,"I searched a song, only 1 song came up with that exact name, with all other songs being different to what I searched for. I had to add artists's name and then the song came up. Why didn't this song, despite being named the exact name, show up?",1,0,
40953,2022-03-31 16:37:27,Insists on being the DEFAULT to any audio files on my phone regardless of how many times I uncheck the box in settings. DELETING APP.,1,0,
56288,2022-02-01 06:01:03,A song won't load and it's the only way I can get to sleep. FIX. IT.,1,0,
51731,2022-02-17 10:03:38,"Okay. I admit the app itself is neat. But there's one, big, disgusting issue staring you in the face: its enforcement of premium. Ads are way too frequent. I'm jammin' to something one moment and then dreading the overblown ad scene of our society the next. And god, oh god, the playlist system. I can't even play LOCAL FILES without being forced to listen to COMPLETELY IRRELEVANT SONGS on an irreversible SHUFFLE with NO CONTROL over my own LOCAL FILES. It's laughable. Actually laughable.",2,0,
10070,2022-06-17 04:49:52,To much advertising and most of the music it play ain't even on my list it's just a headache when i want to hear my music.,1,0,
51696,2022-02-17 13:19:21,"Remove those annoying notifications I get +7 times a day ""Going for a drive? We've lined up your favorite podcasts and tunes"". I've already disabled every notifications in the app, so the ball is in your court. I might consider changing my rating IF you remove these annoying notifications.",1,1,
53154,2022-02-11 16:53:53,"Ok, but the longer you listen to free music, the more frequent the adds become. Cheap marketing schemes to get you to buy premium.",2,0,
24071,2022-05-09 05:59:51,"Constantly crashes on Samsung 21 ultra! So glitchy its hardly worthwhile. If it wasnt for JRE, I would be elsewhere.",1,0,
10316,2022-06-16 14:48:06,"I can't even open my liked songs list, please fix this already!!",1,0,
46964,2022-03-08 18:35:22,Just logged me out of my account for no reason it was working perfectly fine yesterday and now it's not letting me in using log in without password doesn't work either and just says error,1,2,
29471,2022-04-25 01:38:38,Playlists messing up not doing what they are supposed to in ability to restart playlists but I I've seen it work before so I am very disappointed it stopped working,2,0,
29245,2022-04-25 15:46:14,Not what it used to be. Too many suggested podcasts and genres that have literally nothing to do with what I listen to. For a premium account it is ridiculous.,1,0,
25122,2022-05-06 08:24:10,I cant even listen to anything at my phonei have to connect it to pc to start playing songs,1,0,
13259,2022-06-09 11:50:08,What is this kind of problem? My Wi-Fi has high-speed network but the song isn't playing. Is this maintenance problem?,1,1,
43407,2022-03-21 08:09:13,I might give a higher rating if the tons of commercials in this app weren't 5 times louder than the music. Making the Ads obnoxious won't make me want to renew my subscription.,2,2,
15249,2022-06-03 17:12:10,"This app is nice with how they recommend songs, but unless you have premium you can't skip any of the songs which is very stupid. It doesn't allow you to listen to a specific song and when you pick a Playlist it will play songs that aren't even in it. Sometimes the songs it plays for you aren't even in the same language. Hearing lots of good things about this app I was disappointed",2,10,
22505,2022-05-13 19:00:49,"If your thinking of using this free, don't even bother. It's so much better on pc. The free version is a joke. I just found out that you can't even play a song separately. You gotta add it to a playlist and then play that full list waiting for that song to arrive. On suffle btw. And you get like 6 skips an hour. So there's definitely better choices for free users out there.",1,131,
41893,2022-03-27 00:57:15,Recently the experience has been so bad i can't even play the song that I wish. The only way to listen to a song is through shuffle play. Need to fix this or I am not using spotify anymore.,1,2,
30113,2022-04-23 14:41:20,I pay for my premium but after paying nothing happened I still have those ads and i can't download song you already take my money you better pay me back or fix this fast,2,0,
52299,2022-02-15 06:21:07,I hate this app when I tried to look up a so g I want to listen to all it did was give me other songs that didn't even come close to the meaning of the song I was looking for and when I did find the song I wanted it would replace it with a new song if I could I would give this app a 0,1,0,
38531,2022-04-11 10:19:56,"The apps has a lot of errors recently. Some downloaded playlists can not be played because it says I'm offline, even when I am connected to Wi-Fi at home. This is only one example of some errors. I would expect more from the biggest music platforms that exist today.",2,1,
28028,2022-04-28 08:09:02,Fir your tech team ye morons in Spotify. Half the time your app cannot detect internet and reports that there is no internet. Not a single other app on my phone has this problem. And this issue is reported since last few years yet you don't fix it. Pathetic.,1,0,
21123,2022-05-17 17:22:49,"If you dont have premium, you cant play any of the songs you want, i really want to play some songs but i really cant. Please fix this.",1,0,
7329,2022-06-23 08:57:52,"Please stop adding songs to my playlist 🙏 , you are ruining my day with those songs",2,0,
7764,2022-06-22 09:54:21,"Spotify is a good app to listen to music however it forces you to pay like nothing will function, I'm willing to pay it's not a big deal however my experience wasn't good while I didn't pay so I don't think it's worthy to pay for.",1,0,
16606,2022-05-30 18:22:54,Its crashing whenever i tap the play button the app closes automatically,1,0,
26353,2022-05-03 00:21:51,"It works ok, but a has a surprisingly large number of random bugs. Can't use library offline at times. Skipping songs prevents alternating songs from playing. Long load times of downloaded songs. Has large library of songs available, so there's that",2,0,
36092,2022-04-14 04:58:46,"after the latest update it keeps crashing, intermittent pauses. control bar is missing too",2,1,
43028,2022-03-22 20:51:24,"Literally the WORST. The fact you can't play only one song you want to listen to, the ads, the ""only 6 skips per hour"", the adding random songs to my OWN playlist and many more. Honestly disgusting.",1,2,
27858,2022-04-28 16:36:01,Used to be a solid 5. This new update ruined my experience! I no longer can control or skip a track. The player interface is gone. Major deal breaker for me.,2,0,
40618,2022-04-02 08:08:55,This app is not good unless u want to pay. If u don't u can't even listen to ur songs in the order you want them in,1,0,
556,2022-07-08 09:56:54,Whenever I hear an ad on Spotify I vow I will never use that product,2,0,
51968,2022-02-16 13:40:17,"Only use it because I have to. The podcast app I used no longer has my favorite podcasts. I don't like the U.I. , doesn't automatically download the ones I want . Hard to find what I want . I guess if you can't win you just make sure the apps that are better just go away",2,0,
22178,2022-05-14 18:10:55,"UI developers are supposed to make the UI better, not worse. Seems like some dev needed to justify their existence at Spotify and created this stupid new layout so they could look busy at work. Its garbage. Go back to UI kindergarten and revert the complete nonsense changes that were made to music controls (left aligned buttons)",1,1,
39006,2022-04-10 01:38:21,"Android needs car mode back alot of us with motorcycles use it so the screen doesnt black out and ease of use ,and we should be able to listen to our own music on wifi not just bluetooth. other than that seems to be running fine",2,11,
36287,2022-04-13 23:39:45,"Since last update been having NOTHING but problems! Randomly just stops playing music, doesn't show on lock screen what's playing and even after closing app continues to play music. Have to restart phone to turn music off. Fix this asap!!!",1,2,
11882,2022-06-12 22:43:59,"Terrible,Adds song I don't like or add to my playlist,So many Ads and Does not let me go off of the songs I don't like or add",1,0,
38110,2022-04-12 00:58:33,Where the hell did the current playing screen go on mobile? Can't see the current song I'm playing to scroll through music or even skip song that are playing. Locked my phone hoping the widget would come up but nope...? Why?,2,2,
61561,2022-01-01 18:03:07,Too many adds. Many times I get about 5 adds right at the startup of the app. Many times the adds are repeated 2-3 times in the same add break. Extremely annoying. The app is coming off now...,1,0,
59771,2022-01-20 16:20:33,My spotify has been skipping every song that has been playing after the song plays for about a second or so. I have tried uninstalling and restarting my device but nothing has been able to fix the problem. Can't play any songs without them being skipped. :/,1,2,
18187,2022-05-26 15:28:44,"Trash app. I mean, c'mon. Syncing is non existent without updates and even then, it's trash.",1,5,
33919,2022-04-17 01:38:18,"I spend too much money every month for a service that doesn't work. I've been a loyal customer for a long time. I pay for the family plan. Not sure if they are working on the bugs or not. Came on here to see if anyone had gotten a response. Crickets... I figure I'll give it another couple days, and I'll have to cancel my account. At this point, I would highly recommend finding another app.",2,0,
18422,2022-05-25 21:13:59,"The app is super glitchy, crashes all the time, restarts podcasts all the time and the fact that it blacks out video is extremely irritating. EDIT. This app is still absolute garbage.",1,1,
31237,2022-04-21 10:17:59,I cannot give this app more than 1 star because of how much I absolutely despise your 'Suggested Song' Playlist and my inability to turn it off and go back to the songs I handpicked. I also hope Mailchimp and Starbucks are paying you extra to turn up my volume on their ad.,1,5,
34864,2022-04-15 12:19:24,Latest update has me having to close completely out of app to show what song is playing and/or show controls. Was perfect until now 👎 Will update review after problem is fixed.,2,1,
36811,2022-04-13 12:56:49,"Last update messed everything up. It overlays with all the other sounds of my phone. Does not show the control bar on top of the notification bar, so I can't control nor know what song is playing. It doesn't even show the control bar at the app itself. Pretty disappointed.",1,21,
8099,2022-06-21 16:53:39,"Actually this app was really great but it's new update disappoints me, I can't play my favorite songs and it's too restricting. This app makes me infuriated! 😤 And I'm gonna uninstall this right now!",1,0,
51947,2022-02-16 15:09:27,"Use to love it, now when connected to Bluetooth it gets annoying starts playing music on its own even when app has been force stopped. Each time I play a VoiceNote back from WhatsApp, music starts again. Getting so annoying, I considering cancel and deleting it. Just have a actual stop button or something. Even when using maps each time she speaks it starts up again 😠",1,86,
14023,2022-06-07 04:04:07,"Only one subscription available from install, why can't we register a family plan from the start. Why does your company need to keep credit card info? Cant you run the subscription service through Google play like other competitors? You make it more difficult than it needs to be...",2,0,
50989,2022-02-20 03:25:59,Primarily use this app with my car's Kenwood DDX919WS spotify feature. Does not work anymore and just stuck at disconnected. Only works on bluetooth mode with no ability to change playlist. Had to roll back app version to make it work again. Happened with 3 phones with updated spotify android app. Waze app also cannot link to spotify music player properly and would fail at times.,2,4,
8697,2022-06-20 09:27:56,Since past few months the app stops while playing songs suddenly without doing so and I have kept the app updated and also have a good internet connection still the issue is persistent please can you look into it.,1,0,
46869,2022-03-08 18:39:57,Logged me out on several occasions. Customer care is no help and they won't let me back in my account yet they still charge me. Fix this.,2,0,
26900,2022-05-01 12:37:28,Limited selection of music. Not as many of my favorites available. Huge amount of ads.,2,0,
30274,2022-04-23 05:37:58,"Usually great, lately it has been garbage. Sometimes stops playing for a few seconds, and doesn't show the current playing song. Desktop version of spotify is working fine so it's just the app version that is having these issues. Hopefully they will fix it soon.",2,0,
14473,2022-06-05 22:27:12,Recently tried logging back into my account on my phone but was unable to. They would not send me an email or instructions on how to reset my password. There are also way to many adds. The app plays multiple adds in a row and rarely ever gives you an option to get 30 minutes of add-free music. Went ahead and deleted the app and got Pandora.,1,9,
46430,2022-03-08 19:01:29,"It's a good app, but has completely stopped working!! I was listening to music perfectly fine in the morning! I come home and try to open spotify and it logs me out. It's never done that before. Also non of my passwords are working and it's says failed to send a link!! Please fix this problem as fast as possible because for some people spotify is the only thing that helps them or entertains them! What if I miss a live podcast of one of my favourite people!! I need to listen to music! Thanks!!!!!",1,50,
49125,2022-02-28 00:27:15,"I love this app, but today it logged me out and I can log back in. I can log in on the web just fine, but with the app on my phone, no go. Please fix!",1,0,
43933,2022-03-18 23:57:19,"Maybe with all your money you can afford a feature ""not play the same fkn song twice in a row"" on shuffle",2,2,
22487,2022-05-13 20:24:18,bad streaming quality,1,0,
24366,2022-05-08 09:00:29,"Way too many commercials. ""Enjoy the next 30 minutes uninterrupted"" translates to ""listen to the next song and then you get 5 more ads"". The app used to be pretty good but then they got greedy.",1,0,
2574,2022-07-03 23:05:51,Impossible to use liked songs will only play in shuffle controls are unbearable and the app is stuck on one song and will not let me play any others,1,0,
14985,2022-06-04 11:13:43,"I brought the premium plan still Every time I click Spotify icon, it opens and closes automatically. It never allows me to play music on this app. Worst experience.",1,1,
49708,2022-02-25 15:28:31,No lyrics as account holder but family members all have lyrics. I talked to support twice and they say it will happen but it's all the same plan and I used to get lyrics but now as account holder for family plan I don't.,1,0,
57503,2022-01-28 17:58:48,Horrible premium ads. Guaranteed to bug you. No respect for local languages or culture in their ads. Spreads anti vax propaganda,1,4,
