,Time_submitted,Review,Rating,Total_thumbsup,Reply
19220,2022-05-23 13:55:52,Worst because there is no song was started nor find,1,0,
6751,2022-06-24 15:07:07,"My Episodes Folder makes this app useless offline. Every podcast I download is added to My Episode Folder, it happens automatically and it's much harder to remove than how it's added and undownloading an episode doesn't remove it. When offline I to go to downloaded podcasts in my library, but that just brings me to the My Episodes Folder, which won't load because there are undownloaded episodes in it. I can not access my downloaded episodes offline, so why have the app and pay for premium?",1,36,
3398,2022-07-02 03:13:28,Too much ads now a days. So uninstalling the app.,2,0,
16134,2022-06-01 01:56:18,"Needs to be more stable and empowering for user. Excellent and ever improving library. Absolutely terrible client software. This app pauses crashes and buffers more than it should even on locally stored files (Android). Spotify searching and exploration is great when you follow the suggestions less so when you have an idea. The discovery feature is great but it's not enough to account for the bad playback ,gui and organization. I was hesitant to use paid music streaming and now I know why.",1,10,
14778,2022-06-05 00:13:14,Suddenly your app keep on crashing. What's happening? I already uninstall and install it seversl times. I also reset my phone however it doesn't change. Still crashing,1,0,
334,2022-07-08 19:26:52,Would be great if it actually worked. I'm having issues with this app at least 50% of the time.,2,0,
41328,2022-03-30 00:49:19,"Love the app but I hate that now when it's in offline mode, my music will be unavailable until i go back into online mode. Really annoying when it randomly stops in the middle of a playlist during trips to work.",2,0,
32658,2022-04-19 13:41:15,Everything's great and a premium Spotify user for a long time but recent updates got this thing where offline playing is not working. After 2-3 days of putting it on offline mode all downloaded songs are unplayable. This sucks since my nature of work is going to different places/countries for days maybe weeks and without internet. Spotify is my #1 go to app when I'm relaxing. Please fix this,2,1,
35271,2022-04-14 23:31:59,"Was awesome for years until this last update. Can't use now playing, or the next button in my car. It randomly boots up and starts playing or shuts down. Will gladly update review when issues are fixed.",1,1,
29465,2022-04-25 02:16:20,Every update the app gets slower and lags more,1,2,
30444,2022-04-22 20:07:56,I don't like now that you can't pick the songs you want to play and you need premium to pick what song you want to play,1,0,
22757,2022-05-13 04:27:37,"The few months were actually pretty great, but then the new updates got released and it all went down hill from there. It wont play the songs you want it too, if its a playlist you cant pick whick song you want to listen too first, and the playlists have recommendeds in them! 1/10, might change the rating if it becomes better tho",1,0,
29213,2022-04-25 17:15:33,Last update killed it. So buggy and crashes almost every time. Please fix the issues,1,1,
33320,2022-04-18 06:36:35,"It plays all my favorite songs but I only rate it one star because of too much adds or advertisement, and sometimes when I'm in the mood for songs the adds are always in the way I hope you remove too much adds because it's really annoying to be honest. But still I thank you because it played all my favorite songs:)",1,0,
61541,2022-01-02 04:17:17,One star because Spotify did not fullfil it's promise to launch lossless in year 2021. One less star for Lyrics issue. The design of Lyrics layout is not good as compared to other apps. The sync of song with lyrics is not good for many songs. ⭐⭐⭐⭐ To ⭐⭐⭐⭐⭐ Because Spotify improve lyrics.. 👍,1,1,
23347,2022-05-11 06:47:26,Gave me two 20 sec advertisement and two 30 sec advertisement,1,0,
9063,2022-06-19 12:18:22,What the hell happened to Spotify? With the new update you can't even play a playlist. It plays in a random order. You click on a song in the playlist it plays a preview from a random spot in the song. What the hell is this apple music? And listening to music on here is like Pandora now. It plays stations instead of the actual song. You can't even rewind anymore. What the hell spotify?!,1,3,
39758,2022-04-06 16:26:57,"This app, in its current version, crashes on start constantly, effectively making it unusable. As a paying customer, that is unacceptable.",1,0,
25149,2022-05-06 06:33:11,Why cant i choose which song i can hear? Instead i have to listen to to totally different songs. I recommend not getting this app if you have to listen to an entire playlist to listen to one song. My playlist is like 10hrs so i cant get to a song if i wanted to. Bro this app is garbage and only good if you get premium which is a high price for just picking the music you want.,1,0,
40638,2022-04-02 05:11:44,"The local files isn’t showing, even though I’ve already turned on the local files option. Some songs stops on the midway too. Please resolve this problem.",2,0,
61178,2022-01-08 16:11:28,"The latest updates ( I have premium) seemed to have runied the experience. Cuts out , shows wrong tracks, fills up my phone both on device and SDcard memory. Have had to uninstall it from my phone. Will wait a few days then reinstall it again. Will unsubscribe with heavy heart if it has not mega improved!",2,1,
40823,2022-04-01 08:00:26,"What's wrong with spotify lately? Like I've been uninstalling and installing the app for about two days because the app won't open. My internet is good and I have enough storage and my phone works fine, so I don't know what's going on. It's kinda annoying me now. Please fix it.",2,1,
27471,2022-04-29 19:37:23,*update* after transferring to my SD card....today (2 days after) Spotify is in the process of transferring all downloads back to internal storage even though my SD card has more available space!!! Fix this issue Storage on SD card When will you fix the issue with transferring data to SD cards? Every single time I transfer storage to my SD card the app crashes. It's been like this for years now. Fix this dang issue,1,16,
59929,2022-01-19 18:53:00,Phone app gets confused when you have a tv with spotify and the shows often won't play on the TV.,1,0,
9076,2022-06-19 11:14:58,"I like spotify but I HATE that on phone version doesnt really let u skip song that u dont like, I mean u need premium and its super annoying.",2,0,
7257,2022-06-23 12:42:02,"It keeps crashing. Also, it tells me to enjoy the next 30 minutes without interruptions but then I'll hear a commercial within the next 5 minutes. Then it tells me again to enjoy the next 30 minutes without interruptions... and then... another commercial within the next 5 minutes.",2,0,
43836,2022-03-19 11:42:21,"Could someone tell me why the heck when I'm trying to play my song it would go to another song, terrible app if that's the case",1,1,
17649,2022-05-28 05:34:21,Chandwaliya song is a hectic man...stop its advertisement... hearing it for the thousand time is as hell...,1,0,
32825,2022-04-19 05:26:45,How do I listen to music offline I've tried to download podcast and it's doesn't give me what I need I need an app to listen offline using Spotify,1,0,
31972,2022-04-20 13:33:41,"The recent update just broke the app. Every other time I launch the app the player dissapears. I can select and play music, but the actual tab to show what's currently playing, the pause button etc just dissapears! I keep having to completely close down the app and relaunch",1,0,
50084,2022-02-23 23:21:51,"Podcasts are messed up. I'll hit play on episode 1 of a podcast and in the queue it will be like episode 2,3,8,22 and 48. Sometimes nothing in the queue. I have to manually tap them in and out of the queue. It's not as simple as Google podcasts is.",1,11,
40084,2022-04-04 22:07:19,"How does a company as big as Spotify not fix known bugs year after year. It boggles my mind. Why even offer offline listing as a feature if in practice the feature doesn't actually work? On a weeks long camping trip all my ""downloaded"" music stopped being available after 24 hours. Every Spotify user in my group had the same experience while apple music and YouTube music users were able to access their downloaded music the entire trip. What the actual F Spotify?",1,0,
36869,2022-04-13 11:37:19,"Good app but please pay musicians more. Edit: As of the April 2022 update, it has become a mess. The ""floating"" bottom bar that has been added barely ever works or even appears, meaning that music can't be paused or skipped or anything once music starts playing. Also the home screen widget is completely broken. Please fix this Spotify. Also still pay musicians more.",1,0,
60022,2022-01-19 07:25:21,The app great and all you get any song at the swipe of a finger but my problem is why do the keep double charging me The first time I payed for premium plan three days later they charged me again i.e I pay double the amount a month which really sucks 😞 This is the third time they doing it For now am gonna switch to free till they fix the problem If not I'm switching to other streaming service,2,2,
54364,2022-02-07 12:36:45,It would be appreciated if Spotify doesn't decided for us what podcasts we can and cannot listen to.,1,0,
15186,2022-06-03 20:57:18,Had to uninstall Spotify from my device on account of the constant repetitive commercials. Consistently hearing the same commercial THREE TIMES IN A ROW was the final straw. I'm going back to Pandora,1,0,
33617,2022-04-17 16:28:50,"The Ads are so annoying like really! Instead of playing a relaxing ads, it plays something that is just unbearable to ears making me not to use Spotify anymore. I might as well switch to apple music not gonna lie.",2,1,
36061,2022-04-14 05:58:56,"It's buggy. App stops often, the player disappears. Have had to reinstall so many times now. Pretty disappointed this being one of the biggest apps in the world",2,1,
16500,2022-05-31 01:10:50,When on playlists random songs will start playing even if I turn off auto play and turn off the ability for Spotify to add recommended song. Like I made a playlist with my songs to listen to not to get other random ones,2,0,
36875,2022-04-13 11:31:57,"Not to be rude or anything but it's annoying like It told me that I'll get 30minutes of uninterrupted listening but 30minutes isn't over yet and now I'm being interrupted I mean I just want to listen to music and yet the ads are interrupting me please fix that. And when I shuffle play my liked songs the ""unliked"" songs start to play and it's getting really annoying 😖 Also I don't mean to be rude or offend you but please fix my issues I just want to hear music and listen peacefully that's all ^^",1,0,
60314,2022-01-16 20:45:38,"Brilliant service when it works. But the most basic things are still not working. Why do downloaded podcasts not play when in offline mode? The only suggested solutions are reinstall the app and redownload everything. This isn't an option when you're traveling and without data or WiFi, which is the specific reason why I downloaded all of the podcast episodes in the first place. Not good enough for a premium service.",1,206,
39847,2022-04-06 05:45:44,Fix the gdamn podcasts I'm not sure what is going on with ads but stopping the playlist sucks balls,1,0,
10379,2022-06-16 11:59:36,"Spotify Premium user for several years now, app quality seems to consistently get worse over time. Queued songs duplicating, said duplicates deleting queued songs, random songs being added to the queue, shuffle isn't great, etc.",2,0,
43171,2022-03-22 11:16:24,"App forever stopping playback when my phone goes to lock screen or screen off. Tells me to check permissions, all permissions turned on. Have uninstaller multiple times and restarted. No changes",2,1,
4549,2022-06-29 15:53:51,"bring back the ability to play and shuffle at the same time or i'm canceling my premium. this is ridiculous, who asked for that to go away?",1,1,
60479,2022-01-15 08:32:06,Without subscription you can't listen even any three songs without adds. After every two three songs they show there adds of 1 minute not even 30 second they will take your complete 1 minutes after every two-three songs.,1,0,
16121,2022-06-01 02:50:59,Latest update sucks like vacuum the positive experience until date. Fix the bs.,2,0,
7595,2022-06-22 17:20:14,Worst app ever...i purchased premium duo twice to listen song with my friends.. In mobile app it show your package is active and in web it say no package purchase.. are you guys high or what? If you want free money just beg. Don't make stupid app's or just for once fix the issues.,1,0,
28102,2022-04-28 03:19:11,"The app stop by itself, annoying update, need fix",1,0,
3757,2022-07-01 08:19:06,I hate this app because it won't let me change the song it forces me to finish the song that is playing,1,1,
47289,2022-03-08 15:16:18,"Can't load payment page for premium mini, you mean we were not allowed to pay or what? I'll give 1 star until some improvements made.",1,0,
12337,2022-06-11 19:41:49,Too many adds with not enough selection of music. Even when you pay for the service every other day another song I like dissappears.,1,0,
61547,2022-01-02 00:32:34,"I hate this ap I hate what you did to Google Music, that app was perfect. Making me search for the music/podcasts I have downloaded because I know I'm about to be without service is ridiculous. Anything less than good wifi or full mobile reception, and songs will cut in and out. And the ads. I paid for premium ffs. I hate you with every fibre",1,4,
55695,2022-02-03 05:35:37,"Getting revenged by more ads for non paying and ""upgrade"" to premium.",1,0,
57659,2022-01-28 07:35:01,Ads are really annoying. They are destroying the mood Plz change your name to addify It suits better,1,0,
25998,2022-05-03 23:16:37,"There needs to be more options for parental controls and video disable. Spotify family needs to have a LOT more options than kids, or everything. Figure it out.",2,0,
1460,2022-07-06 12:19:59,I Really Love Spotify But app it's not working please fix it,1,0,
55014,2022-02-05 11:43:34,"Let me start off by saying the music quality is fine, the reason for such a low star is the ads. A few days ago I was at the gym I kid you not in ten minutes I heard 5 add. I'm definitely not paying 10 dollars a month either.",1,3,
32456,2022-04-19 19:59:42,My music keeps pausing and resuming even when I ha e good cell signal. It makes the app useless,1,0,
55796,2022-02-02 20:34:30,I cannot view the lyrics even though my app is updated.,2,0,
15527,2022-06-02 21:57:06,Can't believe I'm writing this but Spotify has horrible sound quality compared to Anghami. I tried playing the same song here and there and the distortion is clear. Arabic content is very weak. Would rather use Anghami free version and bear the ads than have the free 3 months premium offer from Spotify. Uninstalling right now.,1,0,
474,2022-07-08 14:06:40,"Thanks for dumping all my downloads without even telling me! Appreciate that! I also love how when I don't have cellular reception, you won't let me play the podcasts that I already downloaded. I also love how as time goes on the more glitchy and unreliable the app becomes. Thanks for letting me down, Spotify!",1,0,
27668,2022-04-29 04:55:00,"I moved from apple music to Spotify, my experience with is really unhappy. The music files have to keep downloading if you don't listen to it often, then if you don't have data or wifi it takes forever to load, it also uses to much data.",1,0,
46808,2022-03-08 18:42:28,They released an update and it kicked me out of my profile and wont let me log back in. Now the app is completely unusable for me,1,1,
5877,2022-06-26 16:21:43,Music cuts out. None of the solutions work,1,0,
34266,2022-04-16 11:42:17,It rarely shows what song I'm playing. Stops randomly and still plays at times adds even though Im been paying for premium.,1,1,
3048,2022-07-02 22:10:27,Why do I need premium to listen to my favorite music,1,0,
5469,2022-06-27 16:24:32,"music quality is good, but on mobile there are just too many ads to the point where it forces you to buy premium. i remember before there was only like 1 ad every 2-3 songs, but ive had instances where ive gotten 15 ads in a row after one song and then another 15 right after its not even funny. this also happens before playing any song on mobile.",2,3,
51561,2022-02-18 00:58:12,"It used to work fine, I could play music, get a few ads, and it would allow me to play any one song on repeat. It's not doing that suddenly and it is extremely frustrating. I thought this would be a great replacement for YouTube but I guess not.",1,0,
25145,2022-05-06 06:48:43,None of my playlists are opening on my mobile app. Not a single song can be played.,1,0,
37220,2022-04-13 00:55:32,"A buggy, frustrating mess - thanks for destroying a previously functional app.",1,0,
12808,2022-06-10 16:28:23,This app was ok at first but my debit card was recently charged without my consent as I cancelled my account last year. This is absolute fraud!!! Do not get spotify!! They take money out of your account illegally!!! They even admitted that my account was cancelled and refused to return my money back!!! Unacceptable!!,1,0,
53255,2022-02-11 08:31:06,Unable to scroll through my 3k liked songs. Been listening on shuffle since last major update.,1,0,
23902,2022-05-09 18:19:09,"Total absence of choice for free users. When trying to select a song, the app will instead offer a playlist of various and occasionally unrelated songs with a CHANCE the song you wanted gets played. Shuffled playlists are nice when they don't interfere with your ability to listen to specific songs. Pair that with the constant barrage of invasive ads, most of which for the app you're already using. Thanks for interrupting my music to remind me i'm using this wreck of a mobile app after each song.",1,12,
30805,2022-04-22 01:57:16,"Your app is jacked. Keeps turning off my podcast to play some stupid music. Just closes for no reason, loses spot. But hey the ads for me to pay for it come through no problem ha who actually pays for this? Update, mid podcast, plays ad, after ad starts another podcast literally 1.5 years old. Says played on the one I was halfway through..",1,1,
42683,2022-03-23 19:23:00,Lately Spotify been worse. The beta version of group sessions was better than the current version.,2,0,
22420,2022-05-14 02:29:35,App is not connected with internet while mobile net is ON,1,0,
9755,2022-06-17 21:12:04,"Wish it would work right.. doesn't show controls (or anything) in notification bar like other apps. constant updates, never see any changes but you better update cause it'll steadily glitch if you don't. Itll lose my place or just suddenly end a podcast early.. Kinda sucks all around. This will probably get deleted like my last review",1,3,
50090,2022-02-23 22:43:49,Didn't turn shuffle on but after last update every playlist just shuffles every song,1,0,
10277,2022-06-16 16:42:43,I love this app but recently i got logged out by mistake and it's not logging me in again i even tried reinstalling and all stuff but nothing worked.,2,0,
22130,2022-05-14 21:43:42,"Latest update has broken Spotify on Samsung entirely. The app simply loads forever, then crashes. Absolutely ridiculous that this update got through testing. Canceling my subscription.",1,0,
21497,2022-05-16 16:27:20,We should be able to filter out or set preference for certain languages. Just because I listen to music in one foreign language does not mean i will understand or enjoy music in languages of neighboring countries. Also we should have control over our main dashboard. I listen to that podcast once and I'm not interested in similar ones. The algorithm assumes incorrectly 99% of the time.,1,28,
10475,2022-06-16 06:07:02,"Sick of it crashing or not finishing a podcast and skipping to the next, uninstalling.",1,0,
60224,2022-01-17 16:53:08,"The app is full of bugs. Autoplay is not working after a song is selected from search. Tried suggested solutions, they don't work. Please fix this. What happens, if you are driving a car? You need to select a new song every time? Other bug, app doesn't quit when you are on home page and press back.",1,23,
10355,2022-06-16 13:07:56,"i hate the new update, there's a song that it's not even my type added to my playlist and it's so frustrating because it's only has 6 skips per hour.",1,0,
38143,2022-04-11 23:46:13,Randomly pauses completely ruins the purpose of the app,1,0,
13254,2022-06-09 11:52:00,Why is it taking so long to play a song one after another????,1,0,
26483,2022-05-02 15:55:39,Spotify is getting 1 star until I'm finally able to hide podcasts entirely from the app.,1,0,
14528,2022-06-05 18:11:37,It's not working properly it gets close and didn't work properly ads are too many,1,0,
52635,2022-02-13 19:06:20,"If I could give it 0 stars, I would. It used to be good but now it glitches and crashes all the time. If I didn't have months of premium left on my account , I would of went to a different streaming service by now. Maybe instead of worrying about Joe Rogan, Spotify's employees should focus on fixing the bugs and crashes this app has on Android all the time.",1,29,
36607,2022-04-13 16:54:40,Where is your customer service? App crashes unexpectedly all the time. Sound goes awry and starts cracking. It crashes my phone and the music is gone. I have to reset the app all the time.,1,0,
16142,2022-06-01 01:06:34,"Spotify itself is great. I can pick my own songs, rewind/skip, and do all the basic things of a music streaming service. The app ruins it all. First of all, if you choose a song you want, it ""shuffles"" it. What that means is it plays different songs than the one you specifically chose. You have to use up all your skips to get the actual song (which it doesn't let you add to playlists). Second, no FF/RWing. Overall, it's a terrible experience and I am moving to Tidal.",1,821,
23895,2022-05-09 18:40:28,Make your application more slowerr! You are more slower than windows 98! Why dont you do black and white on the app to make it more 1098,1,0,
38835,2022-04-10 17:00:56,pause/next track buttons missing since update on Android. Have to use Force Stop. Same on my wife's and sister's phones.,1,1,
9383,2022-06-18 16:28:02,Ads!Ads!Ads annoying me,1,0,
55915,2022-02-02 13:54:06,"App keeps crashing, have tried all suggestions and fixes. Now it won't even load.",2,0,
16589,2022-05-30 19:13:47,Two songs followed by 7 ads sucks,2,0,
12248,2022-06-12 01:10:16,"App is so broken, gets worse every update.",1,0,
31989,2022-04-20 13:15:45,"Frustrating past few weeks... App will force close, now playing bar disappears... Saw this was a known problem, last update fixed this, but now it's back again. Makes it really tempting to switch to a different service...",1,0,
12704,2022-06-10 21:45:23,Money hungry ppl plays 12 ads then play mine music just to give me 3 song then play other 6 ads... trash 🗑️,1,0,
52826,2022-02-12 22:34:46,With Samsung you are almost gaurenteed to subscribe with Spotify... why? Cause it's monthly money to them just to listen to your music. Music use to be free :(,1,0,
54471,2022-02-07 02:28:25,They are shutting down free speech. There are programs they don't have anymore. Silencing people is not right. Everyone has a opinion. Opinions deserve to be heard. This app is a joke. I will be going somewhere else,1,2,
648,2022-07-08 04:28:45,"Recent update broken With this last update I have been unable to access any music. It won't play anything. It doesn't allow me to even play downloaded, or even show my music or podcasts. Fabulous, back to not sleeping well. Upset because it's been fine for years. And now that I rely on the stories and mediations to sleep, now it decides to not work at all.",1,19,
32848,2022-04-19 04:24:45,"Fix your app, i have been using spotify since 2014 and now since 2021 i have issues with spotify mobile, the downloads automatically delete themself when you turn off or restart your phone, the recommendations of a playlist are broken since you reach 500 songs in one playlist and now my session get randomly closed when i close the app.",1,0,
60077,2022-01-18 20:31:40,Garbage. Too bad it's the only option. When selecting offline playback takes forever to open for some reason. Periodically the audio starts and stops for no reason. Works perfectly if the screen is on. Problem persists through several updates.,1,0,
30496,2022-04-22 17:36:57,"Just because of this notification "" until your crush response, have some majaa with latest romantic Tamil songs"" I uninstalled this application.",1,0,
20746,2022-05-18 19:21:55,Too many ads on the base version,1,1,
48800,2022-03-01 12:49:43,"Now plays ads even after you close the app! Update: now more ads, about 90%ads and 10%music, don't be fooled by the 4.5star that was many years ago(see all recent reviews are 1 star), edit still interrupting my music to ask me to rate this app if only i could rate it 0",1,2,"Hey there! Ads are part of our free service, but we definitely appreciate your feedback. If you’ve never had Premium before, you should be eligible for our trial. You can also keep tabs on spotify.com/premium for promos and other discounted plans."
50333,2022-02-22 23:09:40,Way too many back to back ads. Haven't even listened to a full song and had to listen to 3 ads.,1,0,
52645,2022-02-13 18:13:33,I don't like apps that don't take responsibility for content and try distractions instead substantive steps to clean up their act.,2,0,
