,Time_submitted,Review,Rating,Total_thumbsup,Reply
20643,2022-05-19 01:50:42,"I don't know why would anyone without a subscription would download the version for mobile. It's absolutely fill to the brim with ads, it's impossible to use playlists and it feels literally designed to NOT be used without a subscription. The aggressive marketing is the core driven of the mobile version and a slap to the face for any user. This is one of the many good reasons that keep me from buying a subscription or supporting Spotify in any way. Don't install it.",1,16,
5367,2022-06-27 19:52:49,"I used to love this app, it's very relaxing & u can pick any song u want. But I'm very disappointed on the new update, it doesn't let u skip some part of the song & it also won't let u pick any song u like, it will just played a random song. I CANT EVEN PLAY MY OWN PLAYLIST CUZ OF THE SHUFFLE, very disappointing but I'm still hoping the next time y'all update this app, pls remove the shuffle thing & the part when it won't let u skip some part of the song. I hope y'all understand :)",1,0,
25836,2022-05-04 11:51:08,"The widget on the lock screen is creating a lot of problems. Could not find a way to disable it. Samsung phone, Android 11.",2,0,
35633,2022-04-14 15:51:12,"Was good until I started having some issues, the app doesn't play music, I have a connection too. Also songs randomly freeze for a few seconds and play they also don't appear as playing. Please resolve this issue thanks a lot.",1,2,
55731,2022-02-03 02:46:20,The app is ok. But there is a lot of misinformation spread through this app. I'm thinking about dumping them but giving them some time to do the right thing...allowing known misinformation to spread isn't ok. I hear Pandora is cool.,1,3,
59855,2022-01-20 05:51:19,At the first it was good but now after the updates i had to listen 6 ads in a row before I play a song I understand it is all business tactics but its at its peak. More over each ad is about 30 to 40sec we can't even skip. Kindly reduce ads,2,0,
42241,2022-03-25 15:04:07,"For a couple of months your app is unstable. Multiple times I had to re download all songs. Multiple times I was unable to log into my account. Today I tried for 6 hours, no recovery email, not connecting to the internet. This was the last time it ruined my workout session. I think you guys are too occupied with Barcelona sponsoring, to care about your app or your paying customers. So you can find other idiots to support your company for the future!",1,1,
59623,2022-01-21 09:16:05,Ads literally EVERY 2 SONGS why so many ? Not everyone can pay just to listen to songs without ads especially students like me. Atleast make a skip ad button or the ads more short an rare. Everything else is amazing,1,0,
55261,2022-02-04 15:51:46,Now Spotify is pushing for premium.We can't play any individual song now.That's I am giving one rating,1,0,
11081,2022-06-14 18:45:58,"WE'LL HIDE THIS FROM HOME FOR 90 DAYS, How about never put podcasts on my homepage ever. I don't want my music app to be covered in political podcasts. If my family didn't already have a plan I would rather use the free version of Pandora and if I was going to pay I'd use apple music.",1,1,
31753,2022-04-20 18:51:11,fix bugs!!!! Spotify makes billions and has the worst bugs with recent update,1,0,
20374,2022-05-19 21:29:02,"Used to be the best, with each update it gets worse....",1,1,
11994,2022-06-12 16:54:25,Shuffle is not. I would like my playlists to be mixed,2,0,
20359,2022-05-19 22:10:21,Why the hell did you get rid of the Related Artists feature? It was a brilliant way of discovering new artists on the platform and someone had the bright idea to rid of it. Do the right thing and bring it back.,1,1,
9085,2022-06-19 10:43:03,Yeah it's fine when it works properly shame that's a rare occasion,1,0,
38717,2022-04-11 00:05:13,"Latest update is Causing a lot of issues, I'm getting logged out and the song that's currently playing is not showing, after logging in can't access downloaded songs",1,0,
28888,2022-04-26 13:11:42,"Hi, @Spotify @SpotifyCares We noticed that the song 'MONEY' by LISA on some of your playlists has been replaced with an unauthorized song with an identical name. Hope you fix this immediately. Would u mind giving us some advice please @AskSpotifyStars",1,2,
36854,2022-04-13 11:59:58,Recently been very buggy and annoying. No way am i reinstalling to redownload all 12k songs i downloaded,1,0,
43885,2022-03-19 05:53:24,No play by folder on mobile. I'll go premium if you'll have that feature.,1,1,
20618,2022-05-19 03:41:04,"I moved from Apple Music to Spotify because Apple had way too many bugs. Lately, Spotify has had so many bugs and I have reached out, but it's always the same. A link to a forum that tells you how to do a fresh install which does work... temporarily. Then you're back where you started. I understand bugs happen but lately it's really felt like these issues aren't taken very seriously. For the record, I have an S22 with the latest software. I love spotify, but I wish it worked smoother.",2,30,
29525,2022-04-24 22:43:03,Not high quality music,2,0,
8698,2022-06-20 09:25:28,Every time when i open this app and play a song i had to see 2 ads which is very annoying asking to buy subscription again and again This is worst thing in this app,1,0,
60418,2022-01-15 20:45:24,It used to be my favorite app to listen to music but when you got your new update i click on a song i want but then it starts playing a completely different song when i go to my likes my suffle play doesnt work and i cant click on the song i want it just gives me a a 10 second preview of the chores and then stops,1,3,
46232,2022-03-08 19:36:06,"Got logged out while randomly playing my song in my car and now it won't let me log back in, neither with email nor username, saying the account doesn't exist",1,0,
56240,2022-02-01 10:40:26,Put scrolling on the liked songs page back to the way it was and quit screwing it up every 4 months,2,0,
34447,2022-04-16 03:19:03,"So buggy. Play/pause bar keeps randomly disappearing. Stops in middle of songs. Used to be great, but a total mess anymore.",1,4,
20111,2022-05-20 16:59:01,Mr. CEO of Spotify please stop the ads after every song without purchaseing any premium it's very irritating otherwise i have to uninstall the spotify app and think about other app,1,0,
20560,2022-05-19 09:49:57,Too much time takes to launch,1,0,
16305,2022-05-31 13:25:57,Songs added to my favorite list without my permission and not able to play favorites.,1,0,
33927,2022-04-17 01:18:26,I want to give it a 5 because it is an amazing app. However it is not optimized for offline mode. It is not usable and all downloads disappear off your phone within a couple days instead of the allotted 30 day time. I work out of phone service for weeks at a time so having all songs disappear is really terrible.,1,45,
53728,2022-02-09 16:02:38,App cant play songs on a downloaded playlist while offline,1,0,
26988,2022-05-01 05:26:06,"My experience has been bad lately. There is no ""add to queue"" option. The ""go to song radio"" option is also missing. Without these, I think I am really missing out on enjoying the app. I would request Spotify to please fix this bug or roll out help for it because it is really annoying.",1,118,
5443,2022-06-27 17:21:38,"Why can't I edit my suggestion experience, I don't want to see endless lists of music playlists.",1,0,
4500,2022-06-29 17:42:51,Why can't you choose your own songs? It'll make it simpler and give people more freedom.,1,0,
5487,2022-06-27 15:26:43,"I only started using Spotify in 2020 and up until this year I loved it. The issues started with music stopping randomly is I open another app/turn my phone screen off, as well as having issues connecting it to my sonos speaker. Although those issues seemed to have been resolved, I've had enough now. Keep trying to play one playlist, but after playing one song it starts to play the last playlist I played! It's an issue on both my phone and PC.",2,67,
18492,2022-05-25 17:23:26,I have already logged in but everything has got logged out and it is not sending a new link,2,0,
47974,2022-03-05 04:19:58,"Was working just fine, then it wouldn't. Tried to update, it won't update. I can't search for anything, it just hangs. And I pay for it...",1,0,
33442,2022-04-17 23:41:07,"it randomly stops playing, usually when my screen times out. also the banner for the song I'm listening to doesn't show so I can't skip or pause and to stop the app I have to force stop it by closing down the whole app.",1,2,
56680,2022-01-31 01:01:32,Suggested content is off the mark and keeps worming it's way in. It's hard to keep just the content I want. Time to explore other podcast options.,1,0,
48445,2022-03-02 23:35:54,"Used to rly love this app&im still gonna use it,the overall listening exp is good,but thereve been some issues here&there. Starting with that there isnt an obvious way to contact customer support? and as a paying customer I expect that,as I also havent seen a single reply to a review here. My most recent issue is that the scroll bar doesnt seem to work in my liked songs anymore? Its been fun havin to scroll through x liked songs manually... Sadly there isnt more space here, and no customer sup",2,0,
14999,2022-06-04 10:12:03,"I have been a subscriber family for a long time, 5 star no problems, how ever just recent, I have now don't have the lyrics and some songs don't play, please get it all sorted please",2,0,
51970,2022-02-16 13:22:26,always jumps to other singers. too stupid.,1,0,
14764,2022-06-05 01:59:33,I loved it but now idk how to play a full song like the new update you can listen to bit of it to see what it is but idk how to play all of it :/ and i can't play a playlist it will play a random song that i don't even know :|,1,0,
60601,2022-01-14 09:22:41,Every second day i have to reinstall the app and clear cache because when i try to shuffle liked songs it only plays songs that arent in the playlist. It started around christmas and hasnt stopped since. When the app worked it was really good but now Im praying the next song is one in my playlist Literally just had to reinstall after less than an hour since the last time. Please fix this,2,1,
7757,2022-06-22 10:11:40,When I want to play my liked songs it instead play another song and when I play a song it's only for a while I hope it's fixed,2,1,
37727,2022-04-12 14:20:09,"It's ok, but it wont allow me to play my downloaded playlist while offline, and that's annoying.",2,0,
35942,2022-04-14 09:15:56,I am using a premium account and the app keeps crashing. Please rectify it.,2,1,
6219,2022-06-25 20:48:06,I downloaded spotify to try it on my phone and its not lettting me play any songs its absolute garbage,1,0,
46614,2022-03-08 18:51:38,Will not let me log in even if I use the correct information will not let me login without password either,1,0,
57073,2022-01-29 22:09:17,"There are better apps out there. This one is kinda dooky garbagio! Wouldn't recommend. Music in fine, but you could listen to music on just about a 100 different apps. Podcasts are kinda whacky. If you grew up taking public transportation and miss crazy people talking all kinds of nonsense to you while you pretend to be staring out the window minding your own business, this app actually might be your jam.",1,17,
47053,2022-03-08 18:30:32,My account out logged out by itself when it was fine an hr ago . Even if I try to join it is not recognising my mail . This has never happened to me I lost so many playlist of mine 😭,1,2,
10530,2022-06-16 03:11:02,Do not get this app unless you have the money to get premium every month because everytime you make a playlist they feel the need to add 30 songs that you don't like so please only get this if you have money to get premium,1,0,
30564,2022-04-22 14:44:46,Keeps spamming me with demands for Bluetooth permissions when I log in. It does not provide an option to permanently opt out. An app that does not respect me does not get respect from me.,2,0,
37386,2022-04-12 20:59:30,I have no idea how this is still considered a useful app. I listen to many hours of podcasts daily and need to force stop minimum 8-10 times a day.,1,1,
36132,2022-04-14 03:51:06,Too many ads why are there ads I look every and every and every and just ads the ads are about how annoying the ads are if you know your annoying stop being annoying just ads I forget what this app does all I know is it just has ads mobile games should take notes of these ads cause so many why so many your tearing my apart it's horrible it's loud the ads they yell at me please be quite this is a libary they say they be gone for 30 mins they came back in 6 mins do ads know time please don't ads,1,14,
658,2022-07-08 04:04:24,Won't play other songs after clicking the play button and I can't figure out where to turn off shuffle for my liked Playlist.,1,0,
27520,2022-04-29 16:30:51,No playback feature on Android since March 2022. Uninstalled. You guys completely fail as a business. This is outrageous,1,0,
12073,2022-06-12 13:01:22,App consistently closes by itself just after opening it nearly every time for the last week. Please update,1,0,
12839,2022-06-10 14:31:54,Crashes all the time!,1,0,
1739,2022-07-05 20:53:17,"Many problems with this app. #1 You can’t even play the songs you want. Every time I shuffle play liked songs or my own playlists it just plays songs that aren’t even there. #2 Too much ads. #3 Whenever I search for a song, I have to go through every single playlist that appeared till I find the one I want, sometimes I don’t even find it. #4 You have 6 skips every hour but can’t even play what you want so I just skip to the song I want but then my skips are just wasted. You need to fix this.",1,4,
52609,2022-02-13 21:58:20,It use to be so good until the shuffle and it's annoying that there is not setting to turn it off,2,0,
53183,2022-02-11 14:40:53,"The songs are good and all but why does it has so many ads after 1 vid and another also it wont let me play another music if i paused another one, i cant choose which song to play bc i have to shuffle on my playlist, the repeat option aint visible for me anymore(?)",2,2,
12758,2022-06-10 18:36:26,"They will often ""upgrade"" you to more expensive plans without notice and to make it better, returning to your original plan is difficult and time consuming. Stolen money is not returned.",1,0,
6619,2022-06-24 20:46:53,"Had to go back to Spotify Free because Premium was a luxury I can't afford. Being poor is punishment enough without being taunted by awful features of this app. One album I love I haven't heard in entirety for weeks, as if some songs just aren't available. It shuffles in other artists, and plays songs already set to hidden, then the playlist stops before actual completion and I'm expected to start over with songs I've already listened to? Borderline fascism. Spotify are bullies.",1,0,
20427,2022-05-19 18:11:32,My play button has moved to the left of the screen and the skip and back button is rearranged. Dumb design please put it back to the original,1,1,
38793,2022-04-10 19:21:44,"Use to be ok, Listen to 30 sec comercial and get 30 mins of uninterupted music. Now it sucks, listen to one or two songs and then hear two mins of commercials. This only started during covid pandemic and now all they do is beg for people to pay for premium spotify to stop ads. Im almost ready to delete this app totaly. Dont download this app, youll hate it.",1,0,
7119,2022-06-23 18:12:36,Really?3 ads every time I start anything?,1,0,
39137,2022-04-09 13:51:58,"Suddenly the app bugs and I get lost for wanting to use the most BASIC features (find the player, unblock a song etc...). I have to restart the app to find it again.. not expecting that form the biggest music streaming app",2,1,
32007,2022-04-20 12:27:44,"App used to work good till update on my samsung s10. Now i click a song and it doesnt come up that im playing audio but its playing. So i cant pause it in the bottom corner, skip to the next song or anything. On my lockscreen it appears like im not playing audio.",1,2,
57331,2022-01-29 07:15:57,Uninstalling. Done with Spotify's dramas and seemingly recurring bad business decisions.,1,3,
35586,2022-04-14 16:41:42,"App stops at random times. Won't load proper. Autoplays stuff I don't want to hear. Skips episodes I am listening too. If it was for Joe Rogan, I wouldn't allow this on my devices. 👎👎👎👎👎",1,0,
263,2022-07-08 22:57:22,Crashed & support doesn't give a damn. After contacting they gave up because every trouble shoot option they have DOES NO DIFFERENCE.,1,0,
23206,2022-05-11 15:43:44,Very hard to use. Still can't get it set up,1,0,
33974,2022-04-16 22:49:17,Spotify is being a complete prick lately! Why!?,1,0,
2130,2022-07-05 00:09:22,This app doesn't let your critique anything; whether it be like racist or single minded podcasts like behind the bastards or necronomipod. I find it quite humorous that such a large business could be so reckless when so many of their podcast creators destroy lives without little to any evidence.,1,0,
7696,2022-06-22 13:24:43,WORST APP I EVER USED!. I always want to play my songs but it never let's me! Like what the frick. This Is why I think Amazon music is better and simple. This is the worst app ever.,1,0,
33214,2022-04-18 12:30:49,Keeps on crashing after finishing to dload my playlists and transfer the storage to my sd card,1,1,
59217,2022-01-22 19:38:10,Ads are perfectly fine but horror ads at night is a very bad idea. Please consider this thing. I seriously got a mini heart attack for a second.,1,3,
39031,2022-04-09 22:44:22,"About recent bugs Fix your app Spotify, I pay for this, the not playing bug is really annoying, and it dropped out with this update!!! I swear I'll be going to alternative apps...",1,2,
17324,2022-05-29 00:28:00,"I don't know why whenever I open Spotify, it's slow and can't run smoothly. I'm not sure if it's my connection issue but the other app works just fine. I use wifi and have unlimited data yet not working properly. The horrible thing is I can't purchase premium. The code hasn't been delivered to me since yesterday. Idk but this app keeps getting worse.",1,138,
46447,2022-03-08 19:00:28,"I use this app often today i spent 2hrs listening music and after 2-3hrs i opened the app again and it showed u have no acc like how's this possible ? And then i tried login with my phone number nd every time it shows something went wrong i am so annoyed by this app i can't even explain how frustrated i m rn . This happened before also but then i created a new id . I was enjoying my playlist which i had made,my liked songs and all . I don't know why it's showing error. Please look forward to it",1,0,
54664,2022-02-06 12:05:23,It was good in the first but now when I play my playlist it recommend me songs yet I can't play the songs in my playlist and just show a part of it,2,1,
41194,2022-03-30 16:58:52,"My liked song playlist is 2500+ songs, but it only plays the same 50 until i hit the shuffle button again.",2,8,
37222,2022-04-13 00:54:20,"I love this app, it has all of my music. But lately, it has been very buggy. The play bar keeps disappearing please fix this",2,0,
47090,2022-03-08 18:28:50,"It was workimg fine, untill it logged me out of my account. When I tried to log in it took me to creat an account. No method is working. This is present only in Google pixel 6. Please fix this ASAP",1,2,
7332,2022-06-23 08:31:28,"I really have to pay for everything :'( I already have the ads, can't I have the freedom to play the song I want to.",1,1,
8512,2022-06-20 18:55:58,"I absolutely hate this app now. You took away everything i loved about it, I can no longer loop the songs nor can I play a song when a different song is playing. I updated it and that is not the issue. I HIGHLY do NOT recommend this WHATSOEVER.",1,1,
45219,2022-03-12 21:32:16,"Group sessions used to be great, but with the recent updates it is absolutely impossible to join a group session - a friend sent me a link and I clicked it to join, but when the app opens from the link, it is as if nothing has happened. Why switch from the excellent system you had, to this absolute shambles?",2,11,
33596,2022-04-17 17:10:44,The new update broke the freaking app. It keeps pausing my music randomly and resuming at will and the currently playing bar keeps disappearing. I run it on Samsung Ultra 22 and did not have problems until the last update.,1,2,
29167,2022-04-25 19:23:13,Horrible app can't choose a song to listen to only an album and they give you ads and limited skips needs to be updated badly,1,0,
25109,2022-05-06 09:36:40,"The music is great and all but the ads... just because you played the ads doesn't mean that i'll just spend my money on music, I also don't even like the idea of collaborating the playlist with my friends",2,0,
35534,2022-04-14 17:28:10,"good app, but some how the play , stop, pause section has suddenly stop I cannot access it at all, tried all the rest still not working",1,1,
56296,2022-02-01 05:12:31,No prolicing of content allows for a ton of misinformation to spew from Spotify podcasts. I'm looking to move my premium account to another platform.,1,1,
30120,2022-04-23 14:23:21,"""Your username is designed to identify you, so you can't change it"". It no longer identifies me, though...?! Why would you do this and ruin the experience for many people? I might have to make a new account and delete mine in the future in order to be safe. No reason to pay either if experiences are ruined at random by no username changes. Friend activity also is broken and unable to be turned on.",1,5,
34514,2022-04-16 00:31:34,"The entire app breaks every few updates, it's like they have no quality control. It's not just my phone brand either, everyone in my family's Spotify apps have become borderline unusable with this most recent update.",1,2,
28352,2022-04-27 14:35:45,You suggest us to create our own playlist yet you play the song that didnt even listed in our list. You fckng donkey,1,0,
41889,2022-03-27 01:32:56,"Multiple Playlists created, all are hours long. Only hear the same 30-40 minutes worth of songs. But than again, what do you expect from an app that has a Stockholm, Sweden address? I mean it's the same country that gave us ikea. Cheap furniture that lasts a year, yet takes hours to assemble and breaks up Multiple marriages....",1,1,
49209,2022-02-27 18:01:47,Controls not showing up on notification bar and lock screen. 5 stat if my problem gets solved.,2,0,
46587,2022-03-08 18:52:55,"In the middle of listening to a podcast and the app logs me out and won't log back in. Won't keep premium is this is how Spotify's going to ""maintain"" the service.",1,1,
55884,2022-02-02 15:28:31,This app is ridiculous it doesn't accept any debit cards for a free trial in India It always shows payment failed Not expected this from spotify,1,0,
60176,2022-01-18 01:33:11,"Love it for podcasts but I have the premium version but I get ads on the podcasts. Not ones put there by the shows, but Spotify ads. They ruin the flow",1,1,
59369,2022-01-22 06:52:57,Nice app....but there are so many ads in it....its so disturbing....so please remove ads...,2,0,
35156,2022-04-15 02:45:31,Spotify is so buggy now. When you click on songs the control panel at the bottom does not show up and there is noway to get it. You have to close the app. Also music randomly pauses now. My phone is up-to-date and so is the app is updated to the latest version. This is really getting on my nerves as I pay for a family account and it's simply unacceptable now.,1,12,
54227,2022-02-07 22:30:49,Can't access a few of my favorite podcast episodes. We used it because they were supposed to have supported Rogan's freedom online unconditionally. I'll never touch this garbage fire again. I hear piracy is alive and well.,1,0,
35671,2022-04-14 15:17:06,Completely bugged over the past week. Unusable.,1,1,
10715,2022-06-15 16:08:44,"7min of music then 5min of ads Says 30min uninterrupted, 15min later more ads. Less ads on regular radio or free tv, the greed of spotify has ruined the app.",1,0,
34523,2022-04-16 00:09:02,Really need to fix the SD card storage bug so it doesn't have to redownload music after every reboot. It's been years now.,2,3,
29971,2022-04-23 21:07:42,Two ads after every single song,1,0,
45850,2022-03-09 21:55:10,"[Premium] I was one of the many who had the log in glitch for the last couple days. After Uninstalling and reinstalling workout luck, I did contact developer and they sent me a link that brought me back into my account. I was already considering canceling due to them being the worst of all options for paying artists, and now I'm escalating my efforts to pick an alternative. I heard napster (ironically) is the most ethical, so trying them out",2,23,
53532,2022-02-10 10:29:48,"Very confusing and slow to use, stops playing music randomly and doesn't automatically shuffle similar songs. Poor experience.",1,0,
41519,2022-03-29 00:14:04,It's a paid subscription why am i still getting ads.,1,1,
32108,2022-04-20 08:55:00,"Constantly lose the playback bar from my swipe down menu and my lock screen. It also disappeara in the app too, losing the ability to pause music or skip it. I have to force close the app to stop playback. Happens all the time.",1,1,
21732,2022-05-16 02:36:36,Back to back to back to back to back 30 second advertisements even after it said next 30 mins without ads. Have to reset app just to hear music..,2,1,
29933,2022-04-23 22:50:58,Have to Forcestop every time I use Bluetooth in car.,1,1,
